Questions,RESPONSES
what is the basic exam paper format ?,"the question paper id divided into three sections a,b and c and the first section includes 5 to 10 short quetions of 1 to 2 marks and the section b comprises of 4 questions of 10 marks each out of which you have to do 2 questions . each question in this section has two sub-parts.the third section consists of 2 questions with internal choice in each question comprising of 10 marks weightage for each question attempted."
could you explain what is the basic exam paper format?,"the question paper id divided into three sections a,b and c and the first section includes 5 to 10 short quetions of 1 to 2 marks and the section b comprises of 4 questions of 10 marks each out of which you have to do 2 questions . each question in this section has two sub-parts.the third section consists of 2 questions with internal choice in each question comprising of 10 marks weightage for each question attempted."
what guidelines should i follow regarding what is the basic exam paper format?,"the question paper id divided into three sections a,b and c and the first section includes 5 to 10 short quetions of 1 to 2 marks and the section b comprises of 4 questions of 10 marks each out of which you have to do 2 questions . each question in this section has two sub-parts.the third section consists of 2 questions with internal choice in each question comprising of 10 marks weightage for each question attempted."
what are the dos and don’ts about what is the basic exam paper format?,"the question paper id divided into three sections a,b and c and the first section includes 5 to 10 short quetions of 1 to 2 marks and the section b comprises of 4 questions of 10 marks each out of which you have to do 2 questions . each question in this section has two sub-parts.the third section consists of 2 questions with internal choice in each question comprising of 10 marks weightage for each question attempted."
can you tell me what is the basic exam paper format in detail?,"the question paper id divided into three sections a,b and c and the first section includes 5 to 10 short quetions of 1 to 2 marks and the section b comprises of 4 questions of 10 marks each out of which you have to do 2 questions . each question in this section has two sub-parts.the third section consists of 2 questions with internal choice in each question comprising of 10 marks weightage for each question attempted."
how can i issue a book from the library ?,"you can issue a book from the library by submitting your library card. there is a proper procedure to be followed each time you wish to issue a book, which will be guided by the library staff."
could you explain how can i issue a book from the library?,"you can issue a book from the library by submitting your library card. there is a proper procedure to be followed each time you wish to issue a book, which will be guided by the library staff."
what guidelines should i follow regarding how can i issue a book from the library?,"you can issue a book from the library by submitting your library card. there is a proper procedure to be followed each time you wish to issue a book, which will be guided by the library staff."
what are the dos and don’ts about how can i issue a book from the library?,"you can issue a book from the library by submitting your library card. there is a proper procedure to be followed each time you wish to issue a book, which will be guided by the library staff."
can you tell me how can i issue a book from the library in detail?,"you can issue a book from the library by submitting your library card. there is a proper procedure to be followed each time you wish to issue a book, which will be guided by the library staff."
how can i find the book i am looking for easily from the library racks?,"the book shelf area is located opposite to the reading area, there all the books are generally aligned in proper pattern , still if you face trouble finding the book , you can always ask for help from the librarian."
could you explain how can i find the book i am looking for easily from the library racks?,"the book shelf area is located opposite to the reading area, there all the books are generally aligned in proper pattern , still if you face trouble finding the book , you can always ask for help from the librarian."
what guidelines should i follow regarding how can i find the book i am looking for easily from the library racks?,"the book shelf area is located opposite to the reading area, there all the books are generally aligned in proper pattern , still if you face trouble finding the book , you can always ask for help from the librarian."
what are the dos and don’ts about how can i find the book i am looking for easily from the library racks?,"the book shelf area is located opposite to the reading area, there all the books are generally aligned in proper pattern , still if you face trouble finding the book , you can always ask for help from the librarian."
can you tell me how can i find the book i am looking for easily from the library racks in detail?,"the book shelf area is located opposite to the reading area, there all the books are generally aligned in proper pattern , still if you face trouble finding the book , you can always ask for help from the librarian."
how can i be a team member for any sport if i am not an active club member?,you can participate by registering through the qr code provided along with the event information and update.
could you explain how can i be a team member for any sport if i am not an active club member?,you can participate by registering through the qr code provided along with the event information and update.
what guidelines should i follow regarding how can i be a team member for any sport if i am not an active club member?,you can participate by registering through the qr code provided along with the event information and update.
what are the dos and don’ts about how can i be a team member for any sport if i am not an active club member?,you can participate by registering through the qr code provided along with the event information and update.
can you tell me how can i be a team member for any sport if i am not an active club member in detail?,you can participate by registering through the qr code provided along with the event information and update.
what is the fine for late fee submission?,"the fine for the late fee submission is imposed on a daily basis after the last date of the fee submission , it is usually 200 per dayafter the last date."
could you explain what is the fine for late fee submission?,"the fine for the late fee submission is imposed on a daily basis after the last date of the fee submission , it is usually 200 per dayafter the last date."
what guidelines should i follow regarding what is the fine for late fee submission?,"the fine for the late fee submission is imposed on a daily basis after the last date of the fee submission , it is usually 200 per dayafter the last date."
what are the dos and don’ts about what is the fine for late fee submission?,"the fine for the late fee submission is imposed on a daily basis after the last date of the fee submission , it is usually 200 per dayafter the last date."
can you tell me what is the fine for late fee submission in detail?,"the fine for the late fee submission is imposed on a daily basis after the last date of the fee submission , it is usually 200 per dayafter the last date."
what could be the reason for me not being able to access erp?,"it could be due to certain reasons including, incorrect details or erp updation or internet issues, you can always report to the erp cordinator, dr. akash sanghi, in case of any issues."
could you explain what could be the reason for me not being able to access erp?,"it could be due to certain reasons including, incorrect details or erp updation or internet issues, you can always report to the erp cordinator, dr. akash sanghi, in case of any issues."
what guidelines should i follow regarding what could be the reason for me not being able to access erp?,"it could be due to certain reasons including, incorrect details or erp updation or internet issues, you can always report to the erp cordinator, dr. akash sanghi, in case of any issues."
what are the dos and don’ts about what could be the reason for me not being able to access erp?,"it could be due to certain reasons including, incorrect details or erp updation or internet issues, you can always report to the erp cordinator, dr. akash sanghi, in case of any issues."
can you tell me what could be the reason for me not being able to access erp in detail?,"it could be due to certain reasons including, incorrect details or erp updation or internet issues, you can always report to the erp cordinator, dr. akash sanghi, in case of any issues."
what could be the reason for me not being able to view my result?,"it could be due to several reasons, like , not submitting the complete fees for the session , other reasons could be erp updation, internet issues or incorrect details."
could you explain what could be the reason for me not being able to view my result?,"it could be due to several reasons, like , not submitting the complete fees for the session , other reasons could be erp updation, internet issues or incorrect details."
what guidelines should i follow regarding what could be the reason for me not being able to view my result?,"it could be due to several reasons, like , not submitting the complete fees for the session , other reasons could be erp updation, internet issues or incorrect details."
what are the dos and don’ts about what could be the reason for me not being able to view my result?,"it could be due to several reasons, like , not submitting the complete fees for the session , other reasons could be erp updation, internet issues or incorrect details."
can you tell me what could be the reason for me not being able to view my result in detail?,"it could be due to several reasons, like , not submitting the complete fees for the session , other reasons could be erp updation, internet issues or incorrect details."
what if i fail in 'n' number of subjects in a semester?,"if you fail in any number of subjects in a semester, you will have the opportunity to reappear in the carryover exam. for this, you must fill out the carryover exam form and submit the required examination fee."""
could you explain what if i fail in 'n' number of subjects in a semester?,"if you fail in any number of subjects in a semester, you will have the opportunity to reappear in the carryover exam. for this, you must fill out the carryover exam form and submit the required examination fee."""
what guidelines should i follow regarding what if i fail in 'n' number of subjects in a semester?,"if you fail in any number of subjects in a semester, you will have the opportunity to reappear in the carryover exam. for this, you must fill out the carryover exam form and submit the required examination fee."""
what are the dos and don’ts about what if i fail in 'n' number of subjects in a semester?,"if you fail in any number of subjects in a semester, you will have the opportunity to reappear in the carryover exam. for this, you must fill out the carryover exam form and submit the required examination fee."""
can you tell me what if i fail in 'n' number of subjects in a semester in detail?,"if you fail in any number of subjects in a semester, you will have the opportunity to reappear in the carryover exam. for this, you must fill out the carryover exam form and submit the required examination fee."""
what is the fine for damaging college property and the procedure for submission of the same?,a fine of 25000 is imposed.
could you explain what is the fine for damaging college property and the procedure for submission of the same?,a fine of 25000 is imposed.
what guidelines should i follow regarding what is the fine for damaging college property and the procedure for submission of the same?,a fine of 25000 is imposed.
what are the dos and don’ts about what is the fine for damaging college property and the procedure for submission of the same?,a fine of 25000 is imposed.
can you tell me what is the fine for damaging college property and the procedure for submission of the same in detail?,a fine of 25000 is imposed.
in how many installments can i submit my fees and what is the last date?,"in general, you are required to submit your fees in full before the odd semester end semester examinations. however, in case of any emergency, you may request to pay in installments. for this, you must write an application addressed to p.p. singh sir and the registrar sir, get it signed, and then submit it to your hod. once approved, you will receive your admit card from your class incharge (ci)."
could you explain in how many installments can i submit my fees and what is the last date?,"in general, you are required to submit your fees in full before the odd semester end semester examinations. however, in case of any emergency, you may request to pay in installments. for this, you must write an application addressed to p.p. singh sir and the registrar sir, get it signed, and then submit it to your hod. once approved, you will receive your admit card from your class incharge (ci)."
what guidelines should i follow regarding in how many installments can i submit my fees and what is the last date?,"in general, you are required to submit your fees in full before the odd semester end semester examinations. however, in case of any emergency, you may request to pay in installments. for this, you must write an application addressed to p.p. singh sir and the registrar sir, get it signed, and then submit it to your hod. once approved, you will receive your admit card from your class incharge (ci)."
what are the dos and don’ts about in how many installments can i submit my fees and what is the last date?,"in general, you are required to submit your fees in full before the odd semester end semester examinations. however, in case of any emergency, you may request to pay in installments. for this, you must write an application addressed to p.p. singh sir and the registrar sir, get it signed, and then submit it to your hod. once approved, you will receive your admit card from your class incharge (ci)."
can you tell me in how many installments can i submit my fees and what is the last date in detail?,"in general, you are required to submit your fees in full before the odd semester end semester examinations. however, in case of any emergency, you may request to pay in installments. for this, you must write an application addressed to p.p. singh sir and the registrar sir, get it signed, and then submit it to your hod. once approved, you will receive your admit card from your class incharge (ci)."
how can i get my details corrected and updated if filled wrong at the time of admission?,"if you have entered any details incorrectly at the time of admission, you can get them corrected by writing an application mentioning the issue and submitting it in the record room for necessary updates"
could you explain how can i get my details corrected and updated if filled wrong at the time of admission?,"if you have entered any details incorrectly at the time of admission, you can get them corrected by writing an application mentioning the issue and submitting it in the record room for necessary updates"
what guidelines should i follow regarding how can i get my details corrected and updated if filled wrong at the time of admission?,"if you have entered any details incorrectly at the time of admission, you can get them corrected by writing an application mentioning the issue and submitting it in the record room for necessary updates"
what are the dos and don’ts about how can i get my details corrected and updated if filled wrong at the time of admission?,"if you have entered any details incorrectly at the time of admission, you can get them corrected by writing an application mentioning the issue and submitting it in the record room for necessary updates"
can you tell me how can i get my details corrected and updated if filled wrong at the time of admission in detail?,"if you have entered any details incorrectly at the time of admission, you can get them corrected by writing an application mentioning the issue and submitting it in the record room for necessary updates"
"what if i get my identity card missing or broken, what procedure should i follow to get a new one?","if your identity card is lost or damaged, you must inform your hod about the issue. after that, you will be required to pay the applicable fine, following which a new identity card will be issued to you."
"could you explain what if i get my identity card missing or broken, what procedure should i follow to get a new one?","if your identity card is lost or damaged, you must inform your hod about the issue. after that, you will be required to pay the applicable fine, following which a new identity card will be issued to you."
"what guidelines should i follow regarding what if i get my identity card missing or broken, what procedure should i follow to get a new one?","if your identity card is lost or damaged, you must inform your hod about the issue. after that, you will be required to pay the applicable fine, following which a new identity card will be issued to you."
"what are the dos and don’ts about what if i get my identity card missing or broken, what procedure should i follow to get a new one?","if your identity card is lost or damaged, you must inform your hod about the issue. after that, you will be required to pay the applicable fine, following which a new identity card will be issued to you."
"can you tell me what if i get my identity card missing or broken, what procedure should i follow to get a new one in detail?","if your identity card is lost or damaged, you must inform your hod about the issue. after that, you will be required to pay the applicable fine, following which a new identity card will be issued to you."
what is the procedure to update the identity card in case of wrong details?,"first inform your class incharge and then do accordingly, sometimes a application needs to be written to the head of the department and the further steps are guided accordingly."
could you explain what is the procedure to update the identity card in case of wrong details?,"first inform your class incharge and then do accordingly, sometimes a application needs to be written to the head of the department and the further steps are guided accordingly."
what guidelines should i follow regarding what is the procedure to update the identity card in case of wrong details?,"first inform your class incharge and then do accordingly, sometimes a application needs to be written to the head of the department and the further steps are guided accordingly."
what are the dos and don’ts about what is the procedure to update the identity card in case of wrong details?,"first inform your class incharge and then do accordingly, sometimes a application needs to be written to the head of the department and the further steps are guided accordingly."
can you tell me what is the procedure to update the identity card in case of wrong details in detail?,"first inform your class incharge and then do accordingly, sometimes a application needs to be written to the head of the department and the further steps are guided accordingly."
what basic study strategies needs to be followed in the university to excel in semester exams?,"in order to excel in semester exams, you can simply rely on the study material provided by the faculty members and don't forget to check on the previous year question papers which would surely get you sorted."
could you explain what basic study strategies needs to be followed in the university to excel in semester exams?,"in order to excel in semester exams, you can simply rely on the study material provided by the faculty members and don't forget to check on the previous year question papers which would surely get you sorted."
what guidelines should i follow regarding what basic study strategies needs to be followed in the university to excel in semester exams?,"in order to excel in semester exams, you can simply rely on the study material provided by the faculty members and don't forget to check on the previous year question papers which would surely get you sorted."
what are the dos and don’ts about what basic study strategies needs to be followed in the university to excel in semester exams?,"in order to excel in semester exams, you can simply rely on the study material provided by the faculty members and don't forget to check on the previous year question papers which would surely get you sorted."
can you tell me what basic study strategies needs to be followed in the university to excel in semester exams in detail?,"in order to excel in semester exams, you can simply rely on the study material provided by the faculty members and don't forget to check on the previous year question papers which would surely get you sorted."
is there any scholarship for being an internal student if i apply for masters in the same college?,"there’s no direct scholarship for continuing from bachelors to masters, but you can avail it by registering for iucet and qualifying based on your percentage."
could you explain is there any scholarship for being an internal student if i apply for masters in the same college?,"there’s no direct scholarship for continuing from bachelors to masters, but you can avail it by registering for iucet and qualifying based on your percentage."
what guidelines should i follow regarding is there any scholarship for being an internal student if i apply for masters in the same college?,"there’s no direct scholarship for continuing from bachelors to masters, but you can avail it by registering for iucet and qualifying based on your percentage."
what are the dos and don’ts about is there any scholarship for being an internal student if i apply for masters in the same college?,"there’s no direct scholarship for continuing from bachelors to masters, but you can avail it by registering for iucet and qualifying based on your percentage."
can you tell me is there any scholarship for being an internal student if i apply for masters in the same college in detail?,"there’s no direct scholarship for continuing from bachelors to masters, but you can avail it by registering for iucet and qualifying based on your percentage."
what is the minimum attendance percentage i need to maintain for each subject and what are the consequences if i fail to do the same?,"75% attendance is required in each subject, and in case of failing to meet the criteria , consequences could be in the form of fine of 10,000 in case of project based learning subjects and also attendance constitutes a part of internal marking which would be lost in case of failing to meet the parameter values. plus, the student won't be allowed to appear in mid-term exams."
could you explain what is the minimum attendance percentage i need to maintain for each subject and what are the consequences if i fail to do the same?,"75% attendance is required in each subject, and in case of failing to meet the criteria , consequences could be in the form of fine of 10,000 in case of project based learning subjects and also attendance constitutes a part of internal marking which would be lost in case of failing to meet the parameter values. plus, the student won't be allowed to appear in mid-term exams."
what guidelines should i follow regarding what is the minimum attendance percentage i need to maintain for each subject and what are the consequences if i fail to do the same?,"75% attendance is required in each subject, and in case of failing to meet the criteria , consequences could be in the form of fine of 10,000 in case of project based learning subjects and also attendance constitutes a part of internal marking which would be lost in case of failing to meet the parameter values. plus, the student won't be allowed to appear in mid-term exams."
what are the dos and don’ts about what is the minimum attendance percentage i need to maintain for each subject and what are the consequences if i fail to do the same?,"75% attendance is required in each subject, and in case of failing to meet the criteria , consequences could be in the form of fine of 10,000 in case of project based learning subjects and also attendance constitutes a part of internal marking which would be lost in case of failing to meet the parameter values. plus, the student won't be allowed to appear in mid-term exams."
can you tell me what is the minimum attendance percentage i need to maintain for each subject and what are the consequences if i fail to do the same in detail?,"75% attendance is required in each subject, and in case of failing to meet the criteria , consequences could be in the form of fine of 10,000 in case of project based learning subjects and also attendance constitutes a part of internal marking which would be lost in case of failing to meet the parameter values. plus, the student won't be allowed to appear in mid-term exams."
what are the minimum passing marks required?,the minimum passing marks for any subject comprises of 33% of the total marks of the paper.
could you explain what are the minimum passing marks required?,the minimum passing marks for any subject comprises of 33% of the total marks of the paper.
what guidelines should i follow regarding what are the minimum passing marks required?,the minimum passing marks for any subject comprises of 33% of the total marks of the paper.
