Questions,RESPONSES
what is nimriti?,"nimriti is a fashion designing event organized by the fashion designing department, where students showcase their own designed dresses."
could you explain what is nimriti?,"nimriti is a fashion designing event organized by the fashion designing department, where students showcase their own designed dresses."
what guidelines should i follow regarding what is nimriti?,"nimriti is a fashion designing event organized by the fashion designing department, where students showcase their own designed dresses."
what are the dos and don’ts about what is nimriti?,"nimriti is a fashion designing event organized by the fashion designing department, where students showcase their own designed dresses."
can you tell me what is nimriti in detail?,"nimriti is a fashion designing event organized by the fashion designing department, where students showcase their own designed dresses."
can non-fashion students participate in nimriti?,"non–fashion designing students can also participate in nimriti as models, but the dresses showcased belong to fashion designing students."
could you explain can non-fashion students participate in nimriti?,"non–fashion designing students can also participate in nimriti as models, but the dresses showcased belong to fashion designing students."
what guidelines should i follow regarding can non-fashion students participate in nimriti?,"non–fashion designing students can also participate in nimriti as models, but the dresses showcased belong to fashion designing students."
what are the dos and don’ts about can non-fashion students participate in nimriti?,"non–fashion designing students can also participate in nimriti as models, but the dresses showcased belong to fashion designing students."
can you tell me can non-fashion students participate in nimriti in detail?,"non–fashion designing students can also participate in nimriti as models, but the dresses showcased belong to fashion designing students."
what is tasveer?,"tasveer is an event organized by abhiruchi’s images club, featuring photographers along with one male and one female model."
could you explain what is tasveer?,"tasveer is an event organized by abhiruchi’s images club, featuring photographers along with one male and one female model."
what guidelines should i follow regarding what is tasveer?,"tasveer is an event organized by abhiruchi’s images club, featuring photographers along with one male and one female model."
what are the dos and don’ts about what is tasveer?,"tasveer is an event organized by abhiruchi’s images club, featuring photographers along with one male and one female model."
can you tell me what is tasveer in detail?,"tasveer is an event organized by abhiruchi’s images club, featuring photographers along with one male and one female model."
which club organises tasveer?,tasveer is organized by the images club of abhiruchi.
could you explain which club organises tasveer?,tasveer is organized by the images club of abhiruchi.
what guidelines should i follow regarding which club organises tasveer?,tasveer is organized by the images club of abhiruchi.
what are the dos and don’ts about which club organises tasveer?,tasveer is organized by the images club of abhiruchi.
can you tell me which club organises tasveer in detail?,tasveer is organized by the images club of abhiruchi.
do participants need to bring their own costumes or will they be provided?,"all costumes are provided through sponsors, students don’t need to bring their own."
could you explain do participants need to bring their own costumes or will they be provided?,"all costumes are provided through sponsors, students don’t need to bring their own."
what guidelines should i follow regarding do participants need to bring their own costumes or will they be provided?,"all costumes are provided through sponsors, students don’t need to bring their own."
what are the dos and don’ts about do participants need to bring their own costumes or will they be provided?,"all costumes are provided through sponsors, students don’t need to bring their own."
can you tell me do participants need to bring their own costumes or will they be provided in detail?,"all costumes are provided through sponsors, students don’t need to bring their own."
is there any fee to participate in invertia?,"there is no participation fee for invertia, but around ₹11,000 is charged for outfits, makeup, and related expenses."
could you explain is there any fee to participate in invertia?,"there is no participation fee for invertia, but around ₹11,000 is charged for outfits, makeup, and related expenses."
what guidelines should i follow regarding is there any fee to participate in invertia?,"there is no participation fee for invertia, but around ₹11,000 is charged for outfits, makeup, and related expenses."
what are the dos and don’ts about is there any fee to participate in invertia?,"there is no participation fee for invertia, but around ₹11,000 is charged for outfits, makeup, and related expenses."
can you tell me is there any fee to participate in invertia in detail?,"there is no participation fee for invertia, but around ₹11,000 is charged for outfits, makeup, and related expenses."
what is shark tank invertis?,shark tank invertis is organized by abhiruchi’s m factor club to promote startup ideas and provide funding opportunities.
could you explain what is shark tank invertis?,shark tank invertis is organized by abhiruchi’s m factor club to promote startup ideas and provide funding opportunities.
what guidelines should i follow regarding what is shark tank invertis?,shark tank invertis is organized by abhiruchi’s m factor club to promote startup ideas and provide funding opportunities.
what are the dos and don’ts about what is shark tank invertis?,shark tank invertis is organized by abhiruchi’s m factor club to promote startup ideas and provide funding opportunities.
can you tell me what is shark tank invertis in detail?,shark tank invertis is organized by abhiruchi’s m factor club to promote startup ideas and provide funding opportunities.
how the ideas are selected in this?,"first, ideas are registered, and then based on their scope and potential, selected ones get to present in shark tank invertis."
could you explain how the ideas are selected in this?,"first, ideas are registered, and then based on their scope and potential, selected ones get to present in shark tank invertis."
what guidelines should i follow regarding how the ideas are selected in this?,"first, ideas are registered, and then based on their scope and potential, selected ones get to present in shark tank invertis."
what are the dos and don’ts about how the ideas are selected in this?,"first, ideas are registered, and then based on their scope and potential, selected ones get to present in shark tank invertis."
can you tell me how the ideas are selected in this in detail?,"first, ideas are registered, and then based on their scope and potential, selected ones get to present in shark tank invertis."
"if i am at cafeteria , nearest washroom near me?",if you are in ab3/uv block cafeteria the nearest washroom is beside it and if you are at ab2/t block cafe then nearest washroom is the washroom of auditorium
"could you explain if i am at cafeteria , nearest washroom near me?",if you are in ab3/uv block cafeteria the nearest washroom is beside it and if you are at ab2/t block cafe then nearest washroom is the washroom of auditorium
"what guidelines should i follow regarding if i am at cafeteria , nearest washroom near me?",if you are in ab3/uv block cafeteria the nearest washroom is beside it and if you are at ab2/t block cafe then nearest washroom is the washroom of auditorium
"what are the dos and don’ts about if i am at cafeteria , nearest washroom near me?",if you are in ab3/uv block cafeteria the nearest washroom is beside it and if you are at ab2/t block cafe then nearest washroom is the washroom of auditorium
"can you tell me if i am at cafeteria , nearest washroom near me in detail?",if you are in ab3/uv block cafeteria the nearest washroom is beside it and if you are at ab2/t block cafe then nearest washroom is the washroom of auditorium
where should i go to collect the stationary?,you can collect the stationary from the library itself.
could you explain where should i go to collect the stationary?,you can collect the stationary from the library itself.
what guidelines should i follow regarding where should i go to collect the stationary?,you can collect the stationary from the library itself.
what are the dos and don’ts about where should i go to collect the stationary?,you can collect the stationary from the library itself.
can you tell me where should i go to collect the stationary in detail?,you can collect the stationary from the library itself.
where is the room of hod of computer application department?,the computer applications hod cabin is in room no 48 on the first floor.
could you explain where is the room of hod of computer application department??,the computer applications hod cabin is in room no 48 on the first floor.
what guidelines should i follow regarding where is the room of hod of computer application department??,the computer applications hod cabin is in room no 48 on the first floor.
what are the dos and don’ts about where is the room of hod of computer application department??,the computer applications hod cabin is in room no 48 on the first floor.
can you tell me where is the room of hod of computer application department? in detail?,the computer applications hod cabin is in room no 48 on the first floor.
who is vice chancellor?,dr. y. d. s. arya is the vice chancellor of invertis university.
could you explain who is vice chancellor?,dr. y. d. s. arya is the vice chancellor of invertis university.
what guidelines should i follow regarding who is vice chancellor?,dr. y. d. s. arya is the vice chancellor of invertis university.
what are the dos and don’ts about who is vice chancellor?,dr. y. d. s. arya is the vice chancellor of invertis university.
can you tell me who is vice chancellor in detail?,dr. y. d. s. arya is the vice chancellor of invertis university.
who if chief proctor? where is his office?,mr. amritansh mishra is the chier proctor of the university and his office is in ab-3 room no. 70
could you explain who if chief proctor? where is his office?,mr. amritansh mishra is the chier proctor of the university and his office is in ab-3 room no. 70
what guidelines should i follow regarding who if chief proctor? where is his office?,mr. amritansh mishra is the chier proctor of the university and his office is in ab-3 room no. 70
what are the dos and don’ts about who if chief proctor? where is his office?,mr. amritansh mishra is the chier proctor of the university and his office is in ab-3 room no. 70
can you tell me who if chief proctor? where is his office in detail?,mr. amritansh mishra is the chier proctor of the university and his office is in ab-3 room no. 70
where is the office of transportation incharge?,it is near the college entrance gate on right from the buses takes the entry and exits.
could you explain where is the office of transportation incharge?,it is near the college entrance gate on right from the buses takes the entry and exits.
what guidelines should i follow regarding where is the office of transportation incharge?,it is near the college entrance gate on right from the buses takes the entry and exits.
what are the dos and don’ts about where is the office of transportation incharge?,it is near the college entrance gate on right from the buses takes the entry and exits.
can you tell me where is the office of transportation incharge in detail?,it is near the college entrance gate on right from the buses takes the entry and exits.
where is the placement cell how to become member of it?,it's the crc (corporate resource centre) and present before student record room infront of seminar halls.
could you explain where is the placement cell how to become member of it?,it's the crc (corporate resource centre) and present before student record room infront of seminar halls.
what guidelines should i follow regarding where is the placement cell how to become member of it?,it's the crc (corporate resource centre) and present before student record room infront of seminar halls.
what are the dos and don’ts about where is the placement cell how to become member of it?,it's the crc (corporate resource centre) and present before student record room infront of seminar halls.
can you tell me where is the placement cell how to become member of it in detail?,it's the crc (corporate resource centre) and present before student record room infront of seminar halls.
who is talha khan sir?,he is the vice chairman of invertis innovation and incubation also you can meet him in innovation and incubation centre
could you explain who is talha khan sir?,he is the vice chairman of invertis innovation and incubation also you can meet him in innovation and incubation centre
what guidelines should i follow regarding who is talha khan sir?,he is the vice chairman of invertis innovation and incubation also you can meet him in innovation and incubation centre
what are the dos and don’ts about who is talha khan sir?,he is the vice chairman of invertis innovation and incubation also you can meet him in innovation and incubation centre
can you tell me who is talha khan sir in detail?,he is the vice chairman of invertis innovation and incubation also you can meet him in innovation and incubation centre
where is fees department?,it is present in the library which is opposite to admin.
could you explain where is fees department?,it is present in the library which is opposite to admin.
what guidelines should i follow regarding where is fees department?,it is present in the library which is opposite to admin.
what are the dos and don’ts about where is fees department?,it is present in the library which is opposite to admin.
can you tell me where is fees department in detail?,it is present in the library which is opposite to admin.
how to be a part of abhiruchi?,"if you want to be in presidential team then you should be atleast in second year , first year students can also come in abhiruchi but as active members. to become a part you you have to give interview"
could you explain how to be a part of abhiruchi?,"if you want to be in presidential team then you should be atleast in second year , first year students can also come in abhiruchi but as active members. to become a part you you have to give interview"
what guidelines should i follow regarding how to be a part of abhiruchi?,"if you want to be in presidential team then you should be atleast in second year , first year students can also come in abhiruchi but as active members. to become a part you you have to give interview"
what are the dos and don’ts about how to be a part of abhiruchi?,"if you want to be in presidential team then you should be atleast in second year , first year students can also come in abhiruchi but as active members. to become a part you you have to give interview"
can you tell me how to be a part of abhiruchi in detail?,"if you want to be in presidential team then you should be atleast in second year , first year students can also come in abhiruchi but as active members. to become a part you you have to give interview"
what is abhiruchi and what all clubs are there inside it?,"abhiruchi which is also referred to as the hobby club of invertis university , is a vibrant student-run initiative designed to nurture creativity, leadership, and holistic development. there is rock on , panache , images , m-factor , stride , i-tech , the responsible invertian"
could you explain what is abhiruchi and what all clubs are there inside it?,"abhiruchi which is also referred to as the hobby club of invertis university , is a vibrant student-run initiative designed to nurture creativity, leadership, and holistic development. there is rock on , panache , images , m-factor , stride , i-tech , the responsible invertian"
what guidelines should i follow regarding what is abhiruchi and what all clubs are there inside it?,"abhiruchi which is also referred to as the hobby club of invertis university , is a vibrant student-run initiative designed to nurture creativity, leadership, and holistic development. there is rock on , panache , images , m-factor , stride , i-tech , the responsible invertian"
what are the dos and don’ts about what is abhiruchi and what all clubs are there inside it?,"abhiruchi which is also referred to as the hobby club of invertis university , is a vibrant student-run initiative designed to nurture creativity, leadership, and holistic development. there is rock on , panache , images , m-factor , stride , i-tech , the responsible invertian"
can you tell me what is abhiruchi and what all clubs are there inside it in detail?,"abhiruchi which is also referred to as the hobby club of invertis university , is a vibrant student-run initiative designed to nurture creativity, leadership, and holistic development. there is rock on , panache , images , m-factor , stride , i-tech , the responsible invertian"
can faculty members stay in hostel? are hostels available for faculty?,"yes, the hostel for faculty members is avaiable. they can avail this hostel facility."
could you explain can faculty members stay in hostel? are hostels available for faculty?,"yes, the hostel for faculty members is avaiable. they can avail this hostel facility."
what guidelines should i follow regarding can faculty members stay in hostel? are hostels available for faculty?,"yes, the hostel for faculty members is avaiable. they can avail this hostel facility."
what are the dos and don’ts about can faculty members stay in hostel? are hostels available for faculty?,"yes, the hostel for faculty members is avaiable. they can avail this hostel facility."
can you tell me can faculty members stay in hostel? are hostels available for faculty in detail?,"yes, the hostel for faculty members is avaiable. they can avail this hostel facility."
list of teachers of computer application department?,"as (hod) - dr. akash sanghi , kj (associate hod)- kushal johari, sk (end semester practical incharge) - saurabh kumar, dp (foca linkedin coordinator & digi shakti co-ordinator)- deepak pathak, nk -navnika kapoor, sp (pg training & placement co-ordinator)- siddharth pandey, ksr- kuldeep singh rana, ps- pratha saxena, dm (foca lab coordinator)- deepali mishra, rm (foca room amenities co-ordinator)- rahul mishra, ms- megha saxena, gr (ug training & placement co-ordinator)- geetanjali rautela, ayatul yadav, rs (time-table co-ordinator)- ritik saxena, bs - bharat sharma, sa- sweety agarwal"
could you explain list of teachers of computer application department?,"as (hod) - dr. akash sanghi , kj (associate hod)- kushal johari, sk (end semester practical incharge) - saurabh kumar, dp (foca linkedin coordinator & digi shakti co-ordinator)- deepak pathak, nk -navnika kapoor, sp (pg training & placement co-ordinator)- siddharth pandey, ksr- kuldeep singh rana, ps- pratha saxena, dm (foca lab coordinator)- deepali mishra, rm (foca room amenities co-ordinator)- rahul mishra, ms- megha saxena, gr (ug training & placement co-ordinator)- geetanjali rautela, ayatul yadav, rs (time-table co-ordinator)- ritik saxena, bs - bharat sharma, sa- sweety agarwal"
what guidelines should i follow regarding list of teachers of computer application department?,"as (hod) - dr. akash sanghi , kj (associate hod)- kushal johari, sk (end semester practical incharge) - saurabh kumar, dp (foca linkedin coordinator & digi shakti co-ordinator)- deepak pathak, nk -navnika kapoor, sp (pg training & placement co-ordinator)- siddharth pandey, ksr- kuldeep singh rana, ps- pratha saxena, dm (foca lab coordinator)- deepali mishra, rm (foca room amenities co-ordinator)- rahul mishra, ms- megha saxena, gr (ug training & placement co-ordinator)- geetanjali rautela, ayatul yadav, rs (time-table co-ordinator)- ritik saxena, bs - bharat sharma, sa- sweety agarwal"
what are the dos and don’ts about list of teachers of computer application department?,"as (hod) - dr. akash sanghi , kj (associate hod)- kushal johari, sk (end semester practical incharge) - saurabh kumar, dp (foca linkedin coordinator & digi shakti co-ordinator)- deepak pathak, nk -navnika kapoor, sp (pg training & placement co-ordinator)- siddharth pandey, ksr- kuldeep singh rana, ps- pratha saxena, dm (foca lab coordinator)- deepali mishra, rm (foca room amenities co-ordinator)- rahul mishra, ms- megha saxena, gr (ug training & placement co-ordinator)- geetanjali rautela, ayatul yadav, rs (time-table co-ordinator)- ritik saxena, bs - bharat sharma, sa- sweety agarwal"
can you tell me list of teachers of computer application department in detail?,"as (hod) - dr. akash sanghi , kj (associate hod)- kushal johari, sk (end semester practical incharge) - saurabh kumar, dp (foca linkedin coordinator & digi shakti co-ordinator)- deepak pathak, nk -navnika kapoor, sp (pg training & placement co-ordinator)- siddharth pandey, ksr- kuldeep singh rana, ps- pratha saxena, dm (foca lab coordinator)- deepali mishra, rm (foca room amenities co-ordinator)- rahul mishra, ms- megha saxena, gr (ug training & placement co-ordinator)- geetanjali rautela, ayatul yadav, rs (time-table co-ordinator)- ritik saxena, bs - bharat sharma, sa- sweety agarwal"
is there any scholarship which one can get?,"yes, student can get scholarship in first year during the time of admission by giving iucet exam , also they can apply for government scholarship through http://scholarship.up.gov.in/."
could you explain is there any scholarship which one can get?,"yes, student can get scholarship in first year during the time of admission by giving iucet exam , also they can apply for government scholarship through http://scholarship.up.gov.in/."
what guidelines should i follow regarding is there any scholarship which one can get?,"yes, student can get scholarship in first year during the time of admission by giving iucet exam , also they can apply for government scholarship through http://scholarship.up.gov.in/."
what are the dos and don’ts about is there any scholarship which one can get?,"yes, student can get scholarship in first year during the time of admission by giving iucet exam , also they can apply for government scholarship through http://scholarship.up.gov.in/."
can you tell me is there any scholarship which one can get in detail?,"yes, student can get scholarship in first year during the time of admission by giving iucet exam , also they can apply for government scholarship through http://scholarship.up.gov.in/."
if i am having any kind of issue or anything what should i do where should i go?(it could be anything like complaint or to discuss)?,"firstly, you should address your problem to your respective class incharge, and if problem is not solved then you can address the complaint to the respective hod."
could you explain if i am having any kind of issue or anything what should i do where should i go?(it could be anything like complaint or to discuss)?,"firstly, you should address your problem to your respective class incharge, and if problem is not solved then you can address the complaint to the respective hod."
what guidelines should i follow regarding if i am having any kind of issue or anything what should i do where should i go?(it could be anything like complaint or to discuss)?,"firstly, you should address your problem to your respective class incharge, and if problem is not solved then you can address the complaint to the respective hod."
what are the dos and don’ts about if i am having any kind of issue or anything what should i do where should i go?(it could be anything like complaint or to discuss)?,"firstly, you should address your problem to your respective class incharge, and if problem is not solved then you can address the complaint to the respective hod."
can you tell me if i am having any kind of issue or anything what should i do where should i go?(it could be anything like complaint or to discuss) in detail?,"firstly, you should address your problem to your respective class incharge, and if problem is not solved then you can address the complaint to the respective hod."
where can we find seminar halls?,seminar halls are presnt in ab-6 block.
could you explain where can we find seminar halls?,seminar halls are presnt in ab-6 block.
what guidelines should i follow regarding where can we find seminar halls?,seminar halls are presnt in ab-6 block.
what are the dos and don’ts about where can we find seminar halls?,seminar halls are presnt in ab-6 block.
can you tell me where can we find seminar halls in detail?,seminar halls are presnt in ab-6 block.
where is e-lib?,e-libary is in the front of the admin.
could you explain where is e-lib?,e-libary is in the front of the admin.
what guidelines should i follow regarding where is e-lib?,e-libary is in the front of the admin.
what are the dos and don’ts about where is e-lib?,e-libary is in the front of the admin.
can you tell me where is e-lib in detail?,e-libary is in the front of the admin.
where is medical room?,the medical room is situated on the left side of the e-library.
could you explain where is medical room?,the medical room is situated on the left side of the e-library.
what guidelines should i follow regarding where is medical room?,the medical room is situated on the left side of the e-library.
what are the dos and don’ts about where is medical room?,the medical room is situated on the left side of the e-library.
